{
  "name": "slate",
  "scheme": "dark",
  "tokens": {
    "bg": "#1A212C",
    "panel": "#242D3A",
    "panel-2": "#2C3644",
    "line": "#36414F",
    "line-strong": "#4A5868",
    "text": "#D9E0EA",
    "text-2": "#95A2B3",
    "text-3": "#6C788A",
    "live": "#F2B544",
    "live-ink": "#1A212C",
    "ok": "#7CCB9A",
    "warn": "#E8865A",
    "sel": "#5FA8F5"
  },
  "type": {
    "sans": "\"IBM Plex Sans\", system-ui, sans-serif",
    "mono": "\"IBM Plex Mono\", ui-monospace, monospace",
    "size": "14px"
  },
  "shape": {
    "radius": "6px",
    "paneRadius": "8px"
  },
  "flags": []
}
